{
  "schema_version": 1,
  "generated_at_utc": "2026-07-11T23:23:21.462344Z",
  "source_commit": "f5de1314c3831bd92f6f18aec9d718f279ec1139",
  "source_run_url": "https://github.com/chaitanyarahalkar/packforge/actions/runs/29172003145",
  "environment": {
    "os": "Ubuntu 24.04.4 LTS",
    "kernel": "6.17.0-1018-azure",
    "architecture": "x86_64",
    "cpu": "AMD EPYC 9V74 80-Core Processor",
    "runner": "GitHub Actions 1000025185"
  },
  "tools": {
    "cc": "cc (Ubuntu 13.3.0-6ubuntu2~24.04.1) 13.3.0",
    "cpp": "c++ (Ubuntu 13.3.0-6ubuntu2~24.04.1) 13.3.0",
    "rustc": "rustc 1.97.0 (2d8144b78 2026-07-07)",
    "go": "go version go1.26.4 linux/amd64",
    "packforge": "packforge-cli 0.1.0",
    "upx": "5.2.0"
  },
  "configuration": {
    "packforge_profile": "fast",
    "upx_mode": "--best",
    "warmup_iterations": 1,
    "warm_iterations": 21,
    "cold_iterations": 7,
    "cold_cache_reset": "linux_drop_caches_3"
  },
  "fixtures": [
    {
      "id": "hello-c",
      "source": "tests/fixtures/hello-static.c",
      "source_sha256": "2c7fa189f40553e015ca69e8bdbce72114e644121de5f7e219550f3f7c9b8a5d",
      "artifacts": [
        {
          "kind": "original",
          "bytes": 785304,
          "ratio_basis_points": 10000,
          "sha256": "8d6751a8b0b77ab15147c8eae50f37516702fb0fd7b17beade86ecbba7487ff2",
          "behavior_matches_original": true,
          "reversible": true,
          "deterministic": true,
          "warm_time_ns": {
            "median": 1994740,
            "values": [
              2033797,
              1969321,
              1959988,
              1945756,
              2002029,
              1957254,
              1947609,
              1975761,
              2004975,
              2058423,
              2022710,
              2028689,
              1986317,
              1986386,
              2027988,
              1977484,
              1982781,
              2102339,
              2067432,
              2060196,
              1994740
            ]
          },
          "cold_time_ns": {
            "median": 5213083,
            "values": [
              4751428,
              5157901,
              5313613,
              5497876,
              5213083,
              6152347,
              5033537
            ]
          },
          "peak_rss_kib": {
            "median": 1736,
            "values": [
              1736,
              1864,
              1736,
              1736,
              1736,
              1864,
              1736,
              1864,
              1736,
              1736,
              1864,
              1736,
              1728,
              1864,
              1864,
              1736,
              1864,
              1736,
              1736,
              1864,
              1864
            ]
          }
        },
        {
          "kind": "packforge",
          "bytes": 488310,
          "ratio_basis_points": 6218,
          "sha256": "ce95e489f83dec26fc78b2a27196bca8268479729e0ab1b9fc7a1fa9e2ea7097",
          "behavior_matches_original": true,
          "reversible": true,
          "deterministic": true,
          "warm_time_ns": {
            "median": 11092645,
            "values": [
              10995371,
              11032205,
              10837196,
              10909143,
              10940740,
              11018906,
              11154516,
              11122950,
              11389806,
              11557716,
              11473200,
              11264840,
              11092645,
              11211551,
              10926118,
              11193004,
              10847512,
              11015311,
              10926329,
              11223409,
              11105154
            ]
          },
          "cold_time_ns": {
            "median": 13510031,
            "values": [
              13345458,
              13510031,
              13361901,
              13583009,
              13586895,
              13224347,
              13621397
            ]
          },
          "peak_rss_kib": {
            "median": 1736,
            "values": [
              1736,
              1736,
              1736,
              1864,
              1864,
              1864,
              1864,
              1736,
              1864,
              1736,
              1736,
              1736,
              1736,
              1864,
              1736,
              1732,
              1736,
              1736,
              1864,
              1736,
              1736
            ]
          }
        },
        {
          "kind": "upx",
          "bytes": 308912,
          "ratio_basis_points": 3933,
          "sha256": "8807fa18cc7549874f5f79a0bb92de255a0be479287ed5ded0e8d7c6843820c2",
          "behavior_matches_original": true,
          "reversible": false,
          "deterministic": true,
          "warm_time_ns": {
            "median": 7579163,
            "values": [
              7554396,
              7567686,
              7622618,
              7591321,
              7580014,
              7556269,
              7517632,
              7495499,
              7550240,
              7641476,
              7538883,
              7737628,
              7739491,
              7648896,
              7674995,
              7547386,
              7569809,
              7560856,
              7614605,
              7579163,
              7614276
            ]
          },
          "cold_time_ns": {
            "median": 9630557,
            "values": [
              9653170,
              9598679,
              9630557,
              9635724,
              9503808,
              9500123,
              9663045
            ]
          },
          "peak_rss_kib": {
            "median": 1736,
            "values": [
              1864,
              1864,
              1864,
              1736,
              1736,
              1736,
              1736,
              1800,
              1864,
              1736,
              1736,
              1736,
              1736,
              1800,
              1864,
              1800,
              1732,
              1732,
              1864,
              1864,
              1736
            ]
          }
        }
      ]
    },
    {
      "id": "hello-cpp",
      "source": "tests/fixtures/hello-static.cc",
      "source_sha256": "ebe7f233233add9f7a0c4124c040b553f461789f3e3732d33e18bbaa7d1e6801",
      "artifacts": [
        {
          "kind": "original",
          "bytes": 785304,
          "ratio_basis_points": 10000,
          "sha256": "44fdfc37b520bb74b126f879b04ee800847e0ef93c11fd3238ab621069c77588",
          "behavior_matches_original": true,
          "reversible": true,
          "deterministic": true,
          "warm_time_ns": {
            "median": 1996281,
            "values": [
              1983743,
              1996281,
              1993978,
              1970323,
              1955050,
              1928480,
              2146915,
              1926628,
              2014182,
              2041218,
              2015380,
              1993247,
              1996572,
              1967408,
              2064603,
              2019225,
              2076811,
              2006276,
              1978124,
              1980628,
              2014038
            ]
          },
          "cold_time_ns": {
            "median": 5204941,
            "values": [
              4838758,
              5006828,
              5321885,
              5021559,
              5359310,
              5204941,
              5360222
            ]
          },
          "peak_rss_kib": {
            "median": 1736,
            "values": [
              1864,
              1864,
              1800,
              1736,
              1736,
              1860,
              1736,
              1736,
              1736,
              1736,
              1864,
              1736,
              1864,
              1736,
              1736,
              1736,
              1800,
              1864,
              1864,
              1860,
              1736
            ]
          }
        },
        {
          "kind": "packforge",
          "bytes": 488274,
          "ratio_basis_points": 6217,
          "sha256": "777dc435ffac43565d36f368beac64c16c29e4d3f197d38fa163fecd3b4ae6f2",
          "behavior_matches_original": true,
          "reversible": true,
          "deterministic": true,
          "warm_time_ns": {
            "median": 11083923,
            "values": [
              11110412,
              10916454,
              10906129,
              11125104,
              11464747,
              11153055,
              11190435,
              10968180,
              11059616,
              11223539,
              11224041,
              11179834,
              10949313,
              10956453,
              11094729,
              10949613,
              11024314,
              11161007,
              11083923,
              10923324,
              10980439
            ]
          },
          "cold_time_ns": {
            "median": 13849215,
            "values": [
              14055176,
              13434860,
              13849215,
              14281486,
              13487959,
              14543439,
              13521869
            ]
          },
          "peak_rss_kib": {
            "median": 1736,
            "values": [
              1864,
              1736,
              1736,
              1736,
              1736,
              1864,
              1864,
              1732,
              1864,
              1864,
              1736,
              1800,
              1736,
              1860,
              1736,
              1864,
              1736,
              1732,
              1736,
              1864,
              1860
            ]
          }
        },
        {
          "kind": "upx",
          "bytes": 308908,